#!/usr/bin/env tclsh

set testdir [file dirname $argv0]
source $testdir/tester.tcl

do_execsql_test_on_specific_db {:memory:} create-index-quoted-identifiers {
    CREATE TABLE "t t" ("a a");
    CREATE INDEX "idx idx" ON "t t" ("a a");
    CREATE UNIQUE INDEX "unique idx idx" ON "t t" ("a a");

    SELECT sql FROM sqlite_schema WHERE type='index';
} {
    "CREATE INDEX \"idx idx\" ON \"t t\" (\"a a\")"
    "CREATE UNIQUE INDEX \"unique idx idx\" ON \"t t\" (\"a a\")"
}


# single-column index key: creating unique index fails with duplicates
do_execsql_test_in_memory_any_error create-unique-index-with-duplicates-1 {
    CREATE TABLE t1(a, b);
    INSERT INTO t1 VALUES(1, 1);
    INSERT INTO t1 VALUES(1, 2);
    CREATE UNIQUE INDEX idx1 ON t1(a);
}

# multi-column index key: creating unique index fails with duplicates
do_execsql_test_in_memory_any_error create-unique-index-with-duplicates-2 {
    CREATE TABLE t2(a, b, c);
    INSERT INTO t2 VALUES(1, 2, 3);
    INSERT INTO t2 VALUES(1, 2, 4);
    CREATE UNIQUE INDEX idx2 ON t2(a, b);
}


# single-column index key: creating unique index succeeds because NULLs are never equal
do_execsql_test_on_specific_db {:memory:} create-unique-index-with-duplicates-3 {
    CREATE TABLE t3(a);
    INSERT INTO t3 VALUES(NULL);
    INSERT INTO t3 VALUES(NULL);
    CREATE UNIQUE INDEX idx3 ON t3(a);
    SELECT count(*) FROM t3;
} {2}

# multi-column index key: creating unique index succeeds because NULLs are never equal
do_execsql_test_on_specific_db {:memory:} create-unique-index-with-duplicates-4 {
    CREATE TABLE t4(a, b);
    INSERT INTO t4 VALUES(1, NULL);
    INSERT INTO t4 VALUES(1, NULL);
    CREATE UNIQUE INDEX idx4 ON t4(a, b);
    SELECT count(*) FROM t4;
} {2}

# multi-column index key: creating unique index succeeds when all NULLs
do_execsql_test_on_specific_db {:memory:} create-unique-index-with-duplicates-5 {
    CREATE TABLE t5(a, b);
    INSERT INTO t5 VALUES(NULL, NULL);
    INSERT INTO t5 VALUES(NULL, NULL);
    CREATE UNIQUE INDEX idx5 ON t5(a, b);
    SELECT count(*) FROM t5;
} {2}

# DESC index with NULL comparison: UPDATE WHERE col > NULL should not match any rows
# (comparisons with NULL always yield unknown/false)
do_execsql_test_on_specific_db {:memory:} desc-index-null-comparison {
    CREATE TABLE t6(a TEXT, b INT, c REAL);
    INSERT INTO t6 VALUES ('x', 1, 1.0), (NULL, 2, 2.0), ('y', 3, 3.0);
    CREATE INDEX idx6 ON t6(a DESC, b, c);
    UPDATE t6 SET b = 999 WHERE a > NULL;
    SELECT * FROM t6 ORDER BY b;
} {x|1|1.0
|2|2.0
y|3|3.0}

